{
  "$schema": "https://json-schema.org/draft/2020-12/schema",
  "$id": "https://openttd-model-arena.dev/schemas/setup/doctor-report.v1.json",
  "title": "Doctor report v1",
  "description": "Structured, redacted prerequisite diagnosis for a repository-local Arena setup.",
  "type": "object",
  "additionalProperties": false,
  "required": [
    "report_version",
    "generated_at_utc",
    "checks",
    "has_blocking_failures"
  ],
  "properties": {
    "report_version": {
      "type": "integer",
      "const": 1
    },
    "generated_at_utc": {
      "type": "string",
      "minLength": 20,
      "maxLength": 64
    },
    "checks": {
      "type": "array",
      "minItems": 1,
      "maxItems": 150,
      "items": {
        "$ref": "#/$defs/check"
      }
    },
    "has_blocking_failures": {
      "type": "boolean"
    }
  },
  "$defs": {
    "check": {
      "type": "object",
      "additionalProperties": false,
      "required": [
        "id",
        "status",
        "code",
        "summary",
        "remediation"
      ],
      "properties": {
        "id": {
          "type": "string",
          "minLength": 1,
          "maxLength": 120
        },
        "status": {
          "type": "string",
          "enum": [
            "pass",
            "warning",
            "blocking_failure"
          ]
        },
        "code": {
          "type": "string",
          "minLength": 8,
          "maxLength": 96,
          "pattern": "^ARENA-[A-Z0-9-]+$"
        },
        "summary": {
          "type": "string",
          "minLength": 1,
          "maxLength": 1000
        },
        "remediation": {
          "type": "string",
          "minLength": 1,
          "maxLength": 1000
        },
        "detail": {
          "type": "string",
          "minLength": 1,
          "maxLength": 1000
        }
      }
    }
  }
}
